{
  "release_id": "v5.4-control-plane-bootstrap",
  "mr_id": "MR-00",
  "release_name": "V5.4 Control Plane Bootstrap",
  "status": "built",
  "owners": [
    "platform",
    "runtime",
    "qa",
    "release"
  ],
  "commit_sha": "300deab4cfc0a048f734490821760d750bbb33e5",
  "migration_version": "015_control_plane_shadow_runtime",
  "definition_version": "v5.4",
  "api_schema_hash": "not-set",
  "ci_run_id": "local",
  "gate_result_id": "gate-mr-00-control-plane-bootstrap",
  "rollback_instruction_id": "rollback-mr-00-control-plane-bootstrap",
  "feature_flag_ids": [],
  "slice_cutover_state_ids": [],
  "shadow_compare_report_ids": [
    "scr-v54-shadow-domain-events-vs-audit-events"
  ],
  "invariant_check_ids": [
    "inv-v54-shadow-no-shadow-event-consumed-by-official-projector",
    "inv-v54-api-no-page-specific-business-write",
    "inv-v54-runtime-no-production-demo-fallback",
    "inv-v54-runtime-control-plane-tables-exist",
    "inv-v54-gate-gate-result-machine-generated",
    "inv-v54-release-release-manifest-has-ci-run",
    "inv-v54-case-closed-has-no-open-blocker",
    "inv-v54-case-close-requires-closure-policy",
    "inv-v54-blocker-no-duplicate-open-resolution",
    "inv-v54-service-cannot-directly-change-bed-status",
    "inv-v54-checkout-cannot-directly-write-deposit-entry",
    "inv-v54-checkout-cleaning-required-before-release",
    "inv-v54-bank-import-does-not-create-payment-fact",
    "inv-v54-reconciliation-bank-transaction-single-match-default",
    "inv-v54-ledger-no-edit-old-entry",
    "inv-v54-correction-requires-reason",
    "inv-v54-correction-high-risk-requires-approval",
    "inv-v54-balance-rebuild-after-correction",
    "inv-v54-period-finance-snapshot-from-ledgers",
    "inv-v54-period-expense-not-integrated-not-zero",
    "inv-v54-period-close-freezes-snapshot",
    "inv-v54-period-late-adjustment-append-only",
    "inv-v54-risk-all-items-drill-down",
    "inv-v54-pc-export-has-audit"
  ],
  "acceptance_scenarios": [
    "Control Plane migrations are applied to PostgreSQL",
    "Control Plane schema is verified through information_schema",
    "GateRunner emits CI-bound GateResult evidence",
    "ReleaseManifest is generated from the current GateResult"
  ],
  "go_criteria": [
    "Invariant passed: shadow.no_shadow_event_consumed_by_official_projector",
    "Invariant passed: api.no_page_specific_business_write",
    "Invariant passed: runtime.no_production_demo_fallback",
    "Invariant passed: runtime.control_plane_tables_exist",
    "Invariant passed: gate.gate_result_machine_generated",
    "Invariant passed: release.release_manifest_has_ci_run",
    "Invariant passed: case.closed_has_no_open_blocker",
    "Invariant passed: case.close_requires_closure_policy",
    "Invariant passed: blocker.no_duplicate_open_resolution",
    "Invariant passed: service.cannot_directly_change_bed_status",
    "Invariant passed: checkout.cannot_directly_write_deposit_entry",
    "Invariant passed: checkout.cleaning_required_before_release",
    "Invariant passed: bank.import_does_not_create_payment_fact",
    "Invariant passed: reconciliation.bank_transaction_single_match_default",
    "Invariant passed: ledger.no_edit_old_entry",
    "Invariant passed: correction.requires_reason",
    "Invariant passed: correction.high_risk_requires_approval",
    "Invariant passed: balance.rebuild_after_correction",
    "Invariant passed: period.finance_snapshot_from_ledgers",
    "Invariant passed: period.expense_not_integrated_not_zero",
    "Invariant passed: period.close_freezes_snapshot",
    "Invariant passed: period.late_adjustment_append_only",
    "Invariant passed: risk.all_items_drill_down",
    "Invariant passed: pc.export_has_audit"
  ],
  "no_go_criteria": [
    "Yellow shadow compare report: scr-v54-shadow-domain-events-vs-audit-events"
  ],
  "known_risks": [
    "minimal runner"
  ],
  "created_at_utc": "2026-06-02T12:48:51.976Z",
  "updated_at_utc": "2026-06-02T12:48:51.976Z",
  "released_at_utc": null,
  "locked_at_utc": null
}
