{
  "release_id": "release-mr-02",
  "mr_id": "MR-02",
  "release_name": "Runtime Kernel Operations API",
  "status": "built",
  "owners": [
    "platform",
    "runtime",
    "qa",
    "release"
  ],
  "commit_sha": "1f287882161a597df74dc24f3c87765562ff1847",
  "migration_version": "015_control_plane_shadow_runtime",
  "definition_version": "v5.4",
  "api_schema_hash": "not-set",
  "ci_run_id": "local-mr-02",
  "gate_result_id": "gate-mr-02-runtime-kernel",
  "rollback_instruction_id": "rollback-mr-02-runtime-kernel",
  "feature_flag_ids": [],
  "slice_cutover_state_ids": [],
  "shadow_compare_report_ids": [
    "scr-v54-shadow-domain-events-vs-audit-events"
  ],
  "invariant_check_ids": [
    "inv-v54-shadow-no-shadow-event-consumed-by-official-projector",
    "inv-v54-api-no-page-specific-business-write",
    "inv-v54-runtime-no-production-demo-fallback",
    "inv-v54-runtime-control-plane-tables-exist",
    "inv-v54-gate-gate-result-machine-generated",
    "inv-v54-release-release-manifest-has-ci-run",
    "inv-v54-case-closed-has-no-open-blocker",
    "inv-v54-case-close-requires-closure-policy",
    "inv-v54-blocker-no-duplicate-open-resolution",
    "inv-v54-service-cannot-directly-change-bed-status",
    "inv-v54-checkout-cannot-directly-write-deposit-entry",
    "inv-v54-checkout-cleaning-required-before-release",
    "inv-v54-bank-import-does-not-create-payment-fact",
    "inv-v54-reconciliation-bank-transaction-single-match-default",
    "inv-v54-ledger-no-edit-old-entry",
    "inv-v54-correction-requires-reason",
    "inv-v54-correction-high-risk-requires-approval",
    "inv-v54-balance-rebuild-after-correction",
    "inv-v54-period-finance-snapshot-from-ledgers",
    "inv-v54-period-expense-not-integrated-not-zero",
    "inv-v54-period-close-freezes-snapshot",
    "inv-v54-period-late-adjustment-append-only",
    "inv-v54-risk-all-items-drill-down",
    "inv-v54-pc-export-has-audit"
  ],
  "acceptance_scenarios": [
    "Operations API Minimal API routes are registered in Program.cs through MapOperationsRuntimeEndpoints.",
    "Historical MR-02 compatibility transition evidence exists; current rules supersede it and require retired Workspace/Card prepare/confirm write routes to stay absent.",
    "Operations confirm records CommandSubmission evidence through the command submission store or equivalent.",
    "Operations confirm returns commitStatus and projectionStatus to clients.",
    "The same tenantId plus idempotencyKey and a different payloadHash returns 409 without a second business result.",
    "API boundary guard rejects page-specific business write routes."
  ],
  "go_criteria": [
    "Operations API routes exist.",
    "Historical old API compatibility passed at MR-02; current retired-route guards pass.",
    "Confirm writes CommandSubmission or equivalent submission evidence.",
    "Confirm returns commitStatus/projectionStatus.",
    "same idempotencyKey different payload -> 409.",
    "API boundary check passes.",
    "Executable invariant runner evidence is present.",
    "DB-backed shadow compare evidence is green."
  ],
  "no_go_criteria": [
    "P0: Operations API missing.",
    "P0: retired Workspace/Card write route is registered or bypasses Operations Runtime.",
    "P0: Confirm has no submission evidence.",
    "P0: same idempotencyKey different payload not 409.",
    "P0: page-specific business write API accepted.",
    "P0: executable invariant runner has failed blocking checks.",
    "P0: DB-backed shadow compare is red."
  ],
  "known_risks": [
    "MR-02 historical compatibility adapter is superseded; current architecture requires retired Workspace/Card write routes to stay absent.",
    "Business signoff is outside this automated technical gate and is still required for production promotion."
  ],
  "created_at_utc": "2026-05-30T07:52:32.2232301Z",
  "updated_at_utc": "2026-05-30T08:23:30.529Z",
  "released_at_utc": null,
  "locked_at_utc": null
}
