{
  "release_id": "release-mr-09",
  "mr_id": "MR-09",
  "release_name": "Reconciliation + Correction Center",
  "status": "shadow",
  "owners": [
    "runtime",
    "finance",
    "reconciliation",
    "correction",
    "qa",
    "release",
    "business"
  ],
  "commit_sha": "d06f05909b408f62ca323c9100494ad66cff1b1f",
  "migration_version": "017_reconciliation_runtime;018_reconciliation_matching_manual_decisions;019_reconciliation_mismatch_cases;020_correction_center_schema",
  "definition_version": "v5.4",
  "api_schema_hash": "not-set",
  "ci_run_id": "local-mr-09",
  "gate_result_id": "gate-mr-09-reconciliation-correction",
  "rollback_instruction_id": "rollback-mr-09-runtime-mode",
  "feature_flag_ids": [
    "flag-reconciliation-bank-import-enabled",
    "flag-reconciliation-match-candidate-enabled",
    "flag-reconciliation-manual-match-enabled",
    "flag-reconciliation-mismatch-case-enabled",
    "flag-correction-request-enabled",
    "flag-correction-approve-enabled",
    "flag-correction-apply-enabled",
    "flag-correction-before-after-view-enabled"
  ],
  "slice_cutover_state_ids": [
    "cutover-reconciliation-test-tenant",
    "cutover-correction-center-test-tenant"
  ],
  "shadow_compare_report_ids": [
    "scr-v54-reconciliation-correction-center"
  ],
  "invariant_check_ids": [
    "inv-v54-bank-import-does-not-create-payment-fact",
    "inv-v54-reconciliation-bank-transaction-single-match-default",
    "inv-v54-ledger-no-edit-old-entry",
    "inv-v54-correction-requires-reason",
    "inv-v54-correction-high-risk-requires-approval",
    "inv-v54-balance-rebuild-after-correction"
  ],
  "acceptance_scenarios": [
    "Bank statements can be imported",
    "Import does not generate PaymentConfirmed",
    "System can generate match candidates",
    "Finance can manually confirm a match",
    "Mismatches can create ReconciliationCase",
    "Correction requests require a reason",
    "High-risk corrections require approval",
    "Correction apply only appends reversal or correction entries",
    "StayBalance and DepositBalance can be rebuilt after correction",
    "PC before/after view is visible"
  ],
  "go_criteria": [
    "All MR-09 P0 invariants pass",
    "ShadowCompareReport grade is green",
    "GateResult is generated by gate-runner",
    "Reconciliation and CorrectionCenter support shadow, pilot, active, and rollback routing",
    "Correction rollback is runtime-mode based and compensation is append-only"
  ],
  "no_go_criteria": [
    "P0: bank statement import directly creates business fact",
    "P0: correction directly edits old ledger entry",
    "P0: high-risk correction is applied without approval",
    "P0: balance cannot be rebuilt after correction",
    "P0: shadow event enters official projector",
    "P0: GateResult is not machine generated",
    "P1: mismatch does not generate ReconciliationCase",
    "P1: PC before/after view missing",
    "P1: correction audit missing",
    "P1: candidate duplicate match is not blocked",
    "P2: candidate score explanation incomplete",
    "P2: PC table fields incomplete without fact impact"
  ],
  "known_risks": [
    "MR-09 uses skeleton shadow compare until production shadow rows exist",
    "Full automatic matching remains disabled in active mode"
  ],
  "created_at_utc": "2026-05-30T01:20:00Z",
  "updated_at_utc": "2026-05-30T01:20:00Z",
  "released_at_utc": null,
  "locked_at_utc": null
}
